{
  "manifest_id": "7b3GQk6nM1dH8sZLs9KxV2wqE4pR5aBcDeFgHiJkLmNoPqRsT",
  "version": "1.0.0",
  "manufacturer": "ENRG Labs",
  "model": "ENRG-Node-100",
  "hw_revision": "revA",
  "fw_version": "1.0.0",
  "public_key": "7uYh8p9qR3s2t1uVwXyZAbCdEfGhJkLmNoPqRsTuVwXyZAbC",
  "key_type": "ed25519",
  "capabilities": [
    "energy-metering",
    "signature-reporting"
  ],
  "created_at": "2026-07-25T12:00:00Z",
  "updated_at": "2026-07-25T12:00:00Z",
  "metadata": {
    "voltage": "230V",
    "phase": "single"
  }
}
